{"schemaVersion":"1.0","collectionPolicyId":"forzy-live-window-v1","assetId":"forzy-motor-01","timezone":"America/Sao_Paulo","activeWeekdays":["monday","tuesday","wednesday"],"windowStartLocal":"12:00:00","windowEndLocal":"14:00:00","pollIntervalSeconds":5,"gapThresholdSeconds":15,"effectiveFrom":"2026-08-22T00:00:00.000Z","effectiveTo":null,"configurationHash":"sha256:89bde17193c7a34c80d48828f4e61fc5802caa92169d83f8a9fd8e4c282b1bce"}
